<!ELEMENT biblioteka (dzial*) >
<!ELEMENT dzial (nazwa, ksiazka*) >
<!ELEMENT nazwa (#PCDATA) >
<!ELEMENT ksiazka (autor, autor?, tytul, cena) >
<!ELEMENT autor (imie, nazwisko) >
<!ELEMENT imie (#PCDATA)>
<!ELEMENT nazwisko (#PCDATA)>
<!ELEMENT tytul (#PCDATA)>
<!ELEMENT cena (#PCDATA)>